{
  "run_id": "bm-04-B_mergepilot-d5f501",
  "case_id": "bm-04",
  "group": "B_mergepilot",
  "model": "deepseek-v4-flash",
  "started_at": "2026-08-11T10:37:09Z",
  "finished_at": "2026-08-11T10:37:22Z",
  "status": "completed",
  "findings": [
    {
      "description": "Unsanitized 'directory' parameter is passed directly into an f-string used in os.system to construct a shell command. This allows command injection and arbitrary code execution, e.g., directory='; rm -rf /'. Also dangerous 'rm -rf' operation can cause data loss if directory paths are manipulated.",
      "category": "command-injection",
      "severity": "critical"
    },
    {
      "description": "Unsanitized 'path' and 'host' parameters are interpolated into an f-string passed to subprocess.call with shell=True. This enables remote command execution through crafted values, e.g., path='--upload=none; malicious_command'. Additionally, hardcoded credentials and lack of input validation increase exposure.",
      "category": "command-injection",
      "severity": "critical"
    },
    {
      "description": "execute_command directly passes user input to os.popen, executing arbitrary shell commands. This is a trivial remote code execution vector when input is attacker-controlled.",
      "category": "command-injection",
      "severity": "critical"
    }
  ],
  "decision": "REJECT",
  "fix_applied": null,
  "fix_description": "Replace all shell-based execution with safe APIs: (1) For cleanup_old_files, use pathlib/shutil.rmtree on a resolved, validated directory path, never constructing a shell string. (2) For run_backup, use subprocess.run with a list of arguments (no shell=True) or better use a library like paramiko for SCP; validate host and path against strict patterns and avoid hardcoded credentials. (3) For execute_command, remove arbitrary command execution entirely; use a predefined whitelist of allowed commands and pass arguments as a list to subprocess.run without shell=True. Additionally, apply input validation, allowlisting, and least-privilege principles throughout.",
  "verification_passed": null,
  "rollback_executed": false,
  "human_interventions": [],
  "duration_seconds": 13.55,
  "token_usage": {
    "total_tokens": 1738
  },
  "model_cost": null,
  "audit_events": [
    {
      "phase": "review",
      "findings_count": 3,
      "decision": "REJECT",
      "risk_level": "L2"
    },
    {
      "phase": "fix",
      "status": "described",
      "is_fixable": true
    },
    {
      "phase": "decision",
      "decision": "REJECT"
    }
  ],
  "audit_complete": true,
  "error_detail": null,
  "rag_citations": null,
  "api_request_count": 2,
  "eval_passed": false,
  "eval_reason": "decision=REJECT_expected=HOLD",
  "eval_tp": 3,
  "eval_fp": 0,
  "eval_fn": 0
}