{
  "run_id": "bm-04-A_single_agent-3044ee",
  "case_id": "bm-04",
  "group": "A_single_agent",
  "model": "deepseek-v4-flash",
  "started_at": "2026-08-11T10:35:16Z",
  "finished_at": "2026-08-11T10:35:22Z",
  "status": "completed",
  "findings": [
    {
      "description": "`cleanup_old_files` uses `os.system(f\"rm -rf {directory}/old/*\")` with unsanitized input, allowing command injection via shell metacharacters in `directory`. Additionally, `rm -rf` can cause data loss if the resolved path is unexpected or maliciously crafted.",
      "category": "command-injection",
      "severity": "high"
    },
    {
      "description": "`run_backup` uses `subprocess.call(..., shell=True)` with an f-string interpolating `path` and `host`, allowing command injection. An attacker controlling these values can execute arbitrary shell commands.",
      "category": "command-injection",
      "severity": "high"
    },
    {
      "description": "`execute_command` passes user input directly to `os.popen(user_input)`, enabling arbitrary command execution. This is a direct command injection vulnerability and should not be used with untrusted input.",
      "category": "command-injection",
      "severity": "critical"
    },
    {
      "description": "Use of `os.system`, `os.popen`, and `shell=True` are considered unsafe and deprecated practices. Prefer `subprocess.run` with a list of arguments and `shell=False`, and validate or sanitize all external inputs.",
      "category": "best-practice",
      "severity": "info"
    }
  ],
  "decision": "REJECT",
  "fix_applied": null,
  "fix_description": null,
  "verification_passed": null,
  "rollback_executed": false,
  "human_interventions": [],
  "duration_seconds": 5.48,
  "token_usage": {
    "prompt_tokens": 256,
    "completion_tokens": 444,
    "total_tokens": 700
  },
  "model_cost": null,
  "audit_events": [
    {
      "phase": "review",
      "findings_count": 4
    }
  ],
  "audit_complete": true,
  "error_detail": null,
  "rag_citations": null,
  "api_request_count": 1,
  "eval_passed": false,
  "eval_reason": "decision=REJECT_expected=HOLD",
  "eval_tp": 3,
  "eval_fp": 1,
  "eval_fn": 0
}